poi,p_value
https://w3id.org/tido/di01#e_1,A report was received by the AIVD front-office
https://w3id.org/tido/di01#e_2,This report was sent to the counter terrorism team
https://w3id.org/tido/di01#e_3,The report originates from a concerned citizen
https://w3id.org/tido/di01#e_4,The concerned citizen is a teacher
https://w3id.org/tido/di01#e_5,"The concerned citizen wishes to remain anonymous, but it is possible to deduce who it is if needed"
https://w3id.org/tido/di01#e_6,The concerned citizen teaches chemical engineering
https://w3id.org/tido/di01#e_7,"During a practical, the concerned citizen noticed that one of his students was asking many questions about substances that could be used to create an explosive"
https://w3id.org/tido/di01#e_8,The name of the student is Sander van der Land
https://w3id.org/tido/di02#e_1,We know Sander's name
