seg_id;start;end;speaker;transcription;translation
De_Dienst_afl_6_seg_46;0 days 00:13:15;0 days 00:13:18;Jan; Ja, dat klopt.; Yes, yes, that's right.
De_Dienst_afl_6_seg_47;0 days 00:13:18;0 days 00:13:21;Liesbeth; Zit dat in jou? Heb je dat geleerd?; Yes, is that in you? Did you learn that?
De_Dienst_afl_6_seg_48;0 days 00:13:21;0 days 00:13:33;Jan; Ja, absoluut gaat daar natuurlijk... ...er wordt ontzettend veel op getraind... ...maar er wordt ook op geselecteerd... ...en de ene persoon is daar meer geschikt voor dan de andere persoon.; Yes, that is absolutely, there is of course a lot of training. But that is also selected. And one person is more suitable for that than the other person.
De_Dienst_afl_6_seg_49;0 days 00:13:33;0 days 00:13:41;Mixed; Wist jij altijd dat je hier geschikt voor was? Nee, maar goed, het is ook iets waar je uiteindelijk ingroeit...; Did you always know that you were suitable for this? No, but it is also something that you eventually grow into.
De_Dienst_afl_6_seg_50;0 days 00:13:41;0 days 00:14:14;Jan; ...en het feit dat je... ...na goed, in mijn specifieke geval... ...mijn volgsdienst bij Defensie... ...bij Defensie word je ook opgeleid om in moeilijke situaties te werken... ...en daar leer je heel goed in ieder geval hoe je zelf omgaat... ...in dat soort situaties. In de basis blijft hetzelfde, iemand die vormt mogelijk een bedreiging voor jou... ...en afhankelijk van de manier waarop jij reageert... ...wordt die dreiging erger... ...of kan je uiteindelijk die dreiging misschien ook wel wegnemen... ...door een goed verhaal te vertellen.; And the fact that you, for example in my specific case, my follow-up service at Defensie. At Defensie you are also trained to work in difficult situations. And there you learn very well how to deal with yourself in those kinds of situations. On the basis remains the same. Someone who may form a threat to you. And depending on the way you react, that threat gets worse. Or can you eventually take that threat away by telling a good story?
De_Dienst_afl_6_seg_51;0 days 00:14:14;0 days 00:14:17;Liesbeth; Ja, dus daar is het ook een hoop zelfkennis bij?; Yes, so there is also a lot of self-knowledge.
De_Dienst_afl_6_seg_52;0 days 00:14:17;0 days 00:14:50;Jan; Ja, zeker, maar zelfkennis absoluut... ...training, opleiding is een hele belangrijke... ...maar vooral ook goede voorbereiding. Het gaat er met name om in welke situatie gaan we terechtkomen... ...en welke problemen kunnen we vooraf... ...onderkennen we eigenlijk vooraf... ...welke risico's gaan we lopen... ...en hoe denken we op papier vooraf daarmee om te gaan... ...en op het moment dat je op die manier goed voorbereid bent... ...kan je uiteindelijk ook... ...sta je met een zeker gevoel op straat.; Yes, of course. But self-knowledge absolutely. Training, education is very important. But especially good preparation. It is mainly about, okay, in what situation are we going to end up? And what problems can we prevent in advance? What kind of risks are we going to face? And how do we think about it on paper? And when you are well prepared in that way, you can eventually be on the street with a certain feeling.
De_Dienst_afl_6_seg_53;0 days 00:14:50;0 days 00:15:07;Liesbeth; En als er een operatie van start gaat... ...de voorbereiding zit erop, zeg maar, is klaar... ...de missie gaat tijdwerkelijk beginnen... ...ga jij dan altijd mee... ...of zit jij in een soort control room-achtige situatie... ...dat aan te sturen? Nee, mijn specifieke rol is op straat...; And when an operation starts, the preparation is done, the mission will actually begin. Do you always go with it? Or are you in a kind of control room-like situation to direct that? No, my specific role is on the street.
De_Dienst_afl_6_seg_54;0 days 00:15:07;0 days 00:15:24;Jan; ...dus ik ben inderdaad op straat tijdens de actie... ...en uiteraard wordt daar vanuit kantoor ook... ...vindt daar ook gewoon een deelcoördinatie plaats... ...en dat zijn andere mensen vanuit ons team.; So I am on the street during the action. And of course, from the office there is also a part of coordination taking place. And those are other people from our team.
De_Dienst_afl_6_seg_55;0 days 00:15:24;0 days 00:15:31;Liesbeth; En als een operatie geslaagd is... ...is er dan een collectief moment van ontlading? Absoluut. Opluchting? Blijdschap?; And when an operation has been completed, is there a collective moment of relaxation? Absolutely. Relief, happiness? Yes, definitely.
De_Dienst_afl_6_seg_56;0 days 00:15:31;0 days 00:16:10;Jan; Zeker, zeker. En als we praten over met name het plaatsen... ...van bijvoorbeeld een microfoon bij iemand thuis... ...wat echt wel een hele complexe operatie is... ...waar ook zoveel dingen fout kunnen gaan... ...tijdens de uitvoering. Iedereen is op dat moment natuurlijk ook gewoon op het scherpst... ...en als dat uiteindelijk allemaal gelukt is... ...en iedereen is weer veilig terug op de basis... ...dan is er absoluut wel een moment van ontlading inderdaad... ...en dat is denk ik natuurlijk een menselijke reactie.; And when we talk about, especially, placing a microphone at someone's home, which is really a very complex operation, where so many things can go wrong during the execution. Everyone is of course at the sharpest at that moment. And then, when all of that has been successful and everyone is back safely on the basis, then there is absolutely a moment of relaxation indeed. And yes, that is, I think, a natural human reaction.
De_Dienst_afl_6_seg_57;0 days 00:16:10;0 days 00:16:12;Liesbeth; Zeker, zeker als je net zo iets hebt gedaan.; Yes, certainly, certainly, if you have just done something like that.
De_Dienst_afl_6_seg_58;0 days 00:16:12;0 days 00:16:13;Jan; Ja.; Yes.
De_Dienst_afl_6_seg_59;0 days 00:16:13;0 days 00:16:29;Liesbeth; En hoe bedenk je eigenlijk waar je die microfoon gaat plaatsen? Want we zeggen nu steeds microfoon... ...alsof het net zo'n grote microfoon zijn zoals wij voor ons hebben... ...maar dat zijn natuurlijk piepkleine dingetjes. Hoe bedenk je waar in een huisje zoiets doet? Of wat voor afwegingen zitten er achter?; And how do you actually think about where you are going to place that microphone? We now always say microphone, as if it were just as big a microphone as we have in front of us, but of course those are tiny little things. How do you think about where you do something like that in a house, or what kind of considerations are behind it?
De_Dienst_afl_6_seg_60;0 days 00:16:29;0 days 00:17:00;Jan; Er zitten twee delen aan. Eén is oké, hoe is een locatie waar een microfoon moet komen opgebouwd... ...en waar verwachten we dat mensen uiteindelijk inderdaad het gesprek gaan voeren? Soms weten we dat ook niet van tevoren... ...en dan is het uiteindelijk binnen... ...moeten we bekijken wat de mogelijkheden zijn... ...en bedenken we ter plekke een oplossing. Dus we hebben spullen die we breed kunnen inzetten... ...en afhankelijk van wat we binnen aantreffen... ...maken we gebruik van wat er aanwezig is.; There are two parts to it. One is, okay, how is a location where a microphone has to be built and where do we expect people to eventually have a conversation? And sometimes we don't know that in advance. And then it is ultimately within, we have to look at what the possibilities are and consider a place and a solution. So we have things that we can use broadly and depending on what we find inside, we make use of what is there.
De_Dienst_afl_6_seg_61;0 days 00:17:00;0 days 00:17:03;Liesbeth; Maar dat stukje kun je dus niet voorbereiden?; But you can't prepare that part?
De_Dienst_afl_6_seg_62;0 days 00:17:03;0 days 00:17:04;Jan; Nee.; No.
De_Dienst_afl_6_seg_63;0 days 00:17:05;0 days 00:17:09;Liesbeth; Heb je weleens situaties gezeten waar je bang was? Nee.; Have you ever been in situations where you were afraid?
De_Dienst_afl_6_seg_64;0 days 00:17:09;0 days 00:17:11;Jan; Omdat jij stade zenuwen hebt...; No.
De_Dienst_afl_6_seg_65;0 days 00:17:11;0 days 00:17:18;Liesbeth; ...of omdat de situatie nog niet het voorgediend heeft? Ik denk dat ik het makkelijkst kan omschrijven...; Because you are nervous or because the situation has not yet been developed?
De_Dienst_afl_6_seg_66;0 days 00:17:18;0 days 00:17:43;Jan; ...omdat ik nog nooit het gevoel heb dat we niet volledig controle hadden over de situatie. En het kan best wel zo zijn dat als je een specifieke situatie zou isoleren... ...dat dat voor andere mensen best wel heel erg spannend lijkt als ze daarna kijken... ...maar als je het in het gele plaatje ziet... ...en je weet dat het volledig onder controle is... ...omdat er allerlei andere mensen middelen heen staan...; I think I can describe it the easiest way, because I have never had the feeling that we didn't have full control over the situation. And it can be that if you isolate a specific situation, that it seems very exciting to other people when they look at it, but if you see it in the yellow picture, and you know that it is completely under control
De_Dienst_afl_6_seg_67;0 days 00:17:43;0 days 00:17:57;Mixed; ...die optreden op het moment dat het nodig mocht zijn... ...ja, wat dat betreft is het ook minder spannend. Ik had eerder deze serie aan mijn teamhalft Bart gevraagd... ...ik kwam hem namelijk tegen bij de bus halte...; because there are all kinds of other people around who perform at the moment when it is needed, then it is less exciting. I had previously asked my team leader Bart this series,
De_Dienst_afl_6_seg_68;0 days 00:17:57;0 days 00:18:06;Liesbeth; ...en ik wist niet zeker of ik hem gedacht mocht zeggen... ...nou, dat was in dat geval helemaal prima... ...maar als ik jou een keertje tegenkom op straat... ...dan moet ik je niet herkennen denk ik.; because I ran into him at the bus stop and I wasn't sure if I could tell him what I thought. Well, that was fine in that case, but when I run into you on the street,
De_Dienst_afl_6_seg_69;0 days 00:18:06;0 days 00:18:20;Jan; Nee, liever niet. Want dat is inderdaad best wel complex... ...omdat het zo moest kunnen zijn dat ik wel inderdaad met een operatie bezig ben. Precies.; I don't think I should recognize you. No, rather not. That is indeed quite complex, because it could be that I am indeed working on an operation. Exactly.
De_Dienst_afl_6_seg_70;0 days 00:18:20;0 days 00:18:34;Liesbeth; En dat is natuurlijk ook de reden dat we een andere naam gebruiken... ...maar ook bij jou je stem veranderen. Ja. Het is voor jou nog belangrijker dan misschien voor de andere mensen... ...die ik gesproken heb dat jouw identiteit beschermd blijft.; And that is of course also the reason why we use a different name, but also your voice for others. It is even more important to you than maybe for the other people I have spoken to, because your identity remains protected.
De_Dienst_afl_6_seg_71;0 days 00:18:34;0 days 00:19:02;Jan; Ja, en vooral ook omdat mijn werk voor een belangrijk deel is... ...ook contact hebben met mensen op straat... ...en uiteindelijk op het moment dat ik met mensen op straat spreek... ...goed, voor een groot gedeelte is het ophouden van een verhaal... ...of uiteindelijk het voorkomen dat ze erachter komen... ...wat onze werkelijke reden van aanwezigheid is.; Yes, and especially because my work for an important part is also to have contact with people on the street. And eventually, at the moment I speak to people on the street, well, for a large part it is keeping a story or eventually preventing them from finding out what our actual reason for existence is.
De_Dienst_afl_6_seg_72;0 days 00:19:02;0 days 00:19:04;Liesbeth; O ja, dat is het ook.; Oh yes, that is also the case.
De_Dienst_afl_6_seg_73;0 days 00:19:04;0 days 00:19:30;Jan; Ja, zeker. Want we kunnen niet al ons werk natuurlijk bij nacht en ontij altijd maar uitvoeren. Soms moeten we dat ook gewoon tussen de mensen doen. En dat betekent dus dat mijn contact met de mensen... ...en op die manier dus een deel van ons cover, zoals we dat zeggen... ...van onze dekmantel is. En daar hoort natuurlijk ook mijn stem bij en mijn naam.; Yes, of course. Because we can't always perform our work at night and during the day. Sometimes we just have to do that between people. And that means that my contact with people, and in that way a part of our cover, as they say, of our cover is. And of course that also includes my voice and my name.
De_Dienst_afl_6_seg_74;0 days 00:19:30;0 days 00:19:34;Liesbeth; Ja, dus je moet ook nog eens behoorlijk sociale vaardigheden ervoor hebben?; Yes, so you also have to have a lot of social skills for that.
De_Dienst_afl_6_seg_75;0 days 00:19:34;0 days 00:19:36;Jan; Ja, absoluut.; Yes, absolutely.
De_Dienst_afl_6_seg_76;0 days 00:19:36;0 days 00:19:39;Liesbeth; Je moet een leuk babbeltje met iemand kunnen houden.; You have to be able to have a nice chat with someone.
De_Dienst_afl_6_seg_77;0 days 00:19:39;0 days 00:19:40;Jan; Ja.; Yes, yes.
De_Dienst_afl_6_seg_78;0 days 00:19:41;0 days 00:19:45;Liesbeth; Als buitenstaander vind ik het best een bijzonder verhaal.; As an outsider, I find it quite a special story.
De_Dienst_afl_6_seg_79;0 days 00:19:45;0 days 00:20:20;Jan; Ja, en goed, ik denk ook dat dat ook wel belangrijk is. Het is goed dat je het zegt. Het is ook iets wat wij met een tijd weer terug laten komen binnen ons in het team. We moeten ons blijven realiseren hoe bijzonder uiteindelijk het werk ook is wat we doen. Een van de grote risico's zit hem vooral ook in het gevoel hebben dat je het allemaal onder controle hebt. Hoe comfortabeler je wordt in de uitvoering van je werk... ...hoe meer risico's je uiteindelijk ook gaat nemen en hoe groter de risico's gaan worden.; Yes, and I think that is also important. It is good that you say it. And it is also something that we, well, in the meantime, let come back within us in the team. We have to keep realizing how special the work is, what we do. One of the big risks is mainly the feeling that you have it all under control. And the more comfortable you become in the execution of your work, the more risks you will eventually take and the bigger the risks will become.
De_Dienst_afl_6_seg_80;0 days 00:20:20;0 days 00:20:27;Liesbeth; Hoe voelt het dan nu hier in een microfoon toch vrij open? Voor zover dat kan, over hoe je werkt te praten?; How does it feel to be here in a microphone, quite open, as far as that is possible, talking about your work?
De_Dienst_afl_6_seg_81;0 days 00:20:27;0 days 00:21:09;Jan; Ik vind het ontzettend leuk om te doen. Het is voor mij uiteraard ook nieuw, dat kan je je voorstellen. Maar ik vind het ook heel erg belangrijk. Sommige mensen hebben daar best wel wat vraagtekens bij het werk wat we doen. Ik denk dat het heel erg belangrijk is dat we zoveel mogelijk openheid geven op de punten waar we dat kunnen doen... ...om menselmaat te laten zien dat wij in ieder geval ons werk heel erg serieus nemen... ...en niet over uiteindelijk een license to kill beschikken. En nog meer van dat soort dingen allemaal. Mensen die allerlei ideeën in hun hoofd halen over ons als organisatie.; Well, I think it's incredibly fun to do. It is of course also new for me, you can imagine that. But I also think it is very important. Some people have quite a few questions about the work we do. I think it is very important that we give as much openness as possible to the points where we can do that, to show people that we take our work very seriously and not about eventually having a license to kill and even more of those kinds of things. People who bring all kinds of ideas into their heads about our organization.
De_Dienst_afl_6_seg_82;0 days 00:21:16;0 days 00:21:32;Liesbeth; Hij blijft er zelf behoorlijk rustig onder. Maar wat Jan doet lijkt mij echt het meest zenuwslopende werk dat ik me maar kan voorstellen. Ondertussen komt Bart binnen met het bericht dat Sander is geland op Schiphol. En hij is opgepikt door Mehmet Oezgun, de radicale prediker.; He remains quite calm about it himself, but what Jan does seems to me to be the most nerve-racking work I can imagine. In the meantime, Bart comes in with the news that Sander has landed on Schiphol and he has been picked up by Mehmet Oezgun, the radical preacher.
De_Dienst_afl_6_seg_83;0 days 00:21:34;0 days 00:22:09;Bart; De observatieploegen van de politie zitten achter hem en achter Mehmet Oezgun aan. En zij hebben het volgende geconstateerd. En dat hebben wij gehoord van de idee, de inlichtingendienst van de AIVD bij de politie. En zij houden ons realtime op de hoogte van alles wat er gaande is op dit moment. Sander en Mehmet zijn op een adres geweest met de auto... ...waar ze een sporttas opgehaald hebben en in de kofferbak van de auto hebben gezet. En ze zijn nu onderweg naar Amsterdam.; The police observation teams are behind him and behind Mehmet Oezgun. They have noted the following, and we have just heard of the idea, the intelligence service of the AIVD with the police. And they keep us real-time on top of everything that is going on at the moment. Sander and Mehmet have been to an address with the car where they picked up a sports bag and put it in the trunk of a car. And they are now on their way to Amsterdam.
De_Dienst_afl_6_seg_84;0 days 00:22:14;0 days 00:22:16;Mismatch; We weten niet of wat er in die tassen zit.; Sander and Mehmet in Amsterdam
De_Dienst_afl_6_seg_85;0 days 00:22:16;0 days 00:23:43;Bart; We weten dus ook niet of dat aanslagmogelijke aanslagmiddelen zijn. Maar dan moet je gewoon op dit moment rekening mee houden. De politie zit er bovenop en kunnen ingrijpen ieder moment dat het nodig is. Er is door de politie een bestand gevonden op de computer van Sander met zijn testament. Er is een videoboodschap gevonden van hem... ...waarin hij aankondigt dat hij een aanslag gaat plegen... ...en dat hij afscheid neemt van zijn familie en zijn vrienden. En dan ook een hele ideologische verklaring erbij waarom hij dit doet. Dit doen zij met name... ...dit hebben ze vaak al klaarstaan, al een tijd van tevoren. Er moet iemand zijn die dat op het moment dat deze aanslag daadwerkelijk gelukt is... ...en ook online gaat zetten zodat het voor iedereen duidelijk is dat hij dit gedaan heeft... ...en dat ISIS dit vervolgens ook kan gaan claimen. Dit vereist nog heel veel andere onderzoek... ...maar op dit moment zitten we even in het proberen te voorkomen van de aanslag zelf. In ieder geval de politie zit erbij. Ik denk dat het goed is om gewoon je afspraak maar door te laten gaan. Dit is ook een beetje de aard van ons werk. Het is vaak wachten, wachten, wachten. Ga je gewoon met je afspraak nakomen, ga dat gesprek in... ...en ik hou je op de hoogte als er iets gebeurt.; We don't know what's in those bags. We don't know if those are possible attacks, but you just have to keep that in mind at the moment. The police are on top of it and can intervene at any time it is necessary. The police have found a file on Sander's computer with his will. There was a video message from him in which he announces that he is going to attack and that he is saying goodbye to his family and friends. And then also a very ideological explanation of why he is doing this. They do this mainly, they have often already done this, a while in advance. There must be someone who, when this attack is actually successful, will also put it online so that it is clear to everyone that he did it and that ISIS can then claim it. This requires a lot of other research, but at the moment we are trying to prevent the attack. In any case, the police are on top of it. I think it's good to just let your appointment go. This is also a bit of the nature of our work. It's often waiting, waiting, waiting. Are you just going to keep your appointment? Is the conversation going? And I'll keep you posted if something happens.
De_Dienst_afl_6_seg_86;0 days 00:23:47;0 days 00:23:52;Liesbeth; Ik ga dus praten met Harry, een collega van Jan, die ook in het veld werkt.; So I'm going to talk to Harry, a colleague of Jan's, who also works in the field.
De_Dienst_afl_6_seg_87;0 days 00:23:53;0 days 00:24:07;Harry; Ik ben wat ze noemen operationeel ICT-specialist, operationeel technoot. Technoot is een beetje onderbiedig, maar ik doe heel veel technische dingen op operationeel vlak. Hoofdnaaldje ICT, maar het gaat op eigenlijk allerlei gebieden.; I am an operational ICT specialist. So operational technician. Technician is a bit subversive in itself, but I do a lot of technical things in the operational area. I work mainly in ICT, but it actually goes in all kinds of areas.
De_Dienst_afl_6_seg_88;0 days 00:24:07;0 days 00:24:19;Liesbeth; In de case hebben we natuurlijk de hek op Anas gehad... ...en dat is nou typisch iets dat Harry gedaan zou kunnen hebben. Voor duidelijkheid, Harry is niet zijn echte naam... ...en zoals je wellicht al hebt kunnen horen is ook zijn stem vervormd.; In the case, of course, we had the fence on Anas, and that is typically something that Harry could have done. To be clear, Harry is not his real name, and as you may have already heard, his voice is also formed.
De_Dienst_afl_6_seg_89;0 days 00:24:19;0 days 00:24:49;Harry; Ik ben van de achtergrond ICT'er. Ik heb vrij lang niet iets tegenwerkt met mijn bedrijfsleven... ...en werk al een enige tijd binnen deze organisatie. Het gaat van ICT's die kantoorapplicaties ontwikkelen... ...tot aan echt enorme stoortsystemen... ...tot aan het ontwikkelen van embedded software... ...in middelen die buiten op straat zitten. Dus volle technische breedte die je eigenlijk normaal in veel verschillende organisaties hebt... ...die heb je eigenlijk hier in één organisatie.; I am an ICT specialist by profession. I haven't done anything against it for a long time, just in the business world. And I've been working in this organization for some time now. When it comes to ICT, which develops office applications, to a really huge storage system, to the development of embedded software in means that are available outside. So the full technical breadth of what you normally have in many different organizations, you actually have here in one organization.
De_Dienst_afl_6_seg_90;0 days 00:24:49;0 days 00:24:59;Liesbeth; Dus als er nieuwe technische mogelijkheden zich voordoen... ...dan sta jij te popelen? Ja, dan staan wij op voorraad.; So if there are new technical possibilities, then you stand out. Yes, then we also stand out.
De_Dienst_afl_6_seg_91;0 days 00:24:59;0 days 00:25:33;Harry; Dan zijn we waarschijnlijk de eerste mensen die er mee bezig gaan. Vaak zijn we binnen de organisatie de eerste die de kennis hebben... ...van oké, er staat iets nieuws aan te komen... ...dit gaat impact hebben op de manier hoe we er kunnen werken. Het kan een negatieve impact zijn. Het kan zijn dat er bijvoorbeeld nieuwe beveiligingen zijn op bepaalde gebieden... ...en je denkt van oké, hoe kunnen we daar omheen komen? Het kan ook zijn dat er hele nieuwe technologie op te bijgaan... ...en je denkt van oké, dat geeft ons mogelijkheden. Dan zijn we vaak de eerste die signaleren dat dit soort dingen er zijn. We zeggen oké, wat zijn de mogelijkheden? Dan gaan we daarmee in eerste instantie experimenteren... ...en dan gaan we kijken of we dat tot een middel kunnen pakken... ...wat door onze mensen op straat kan worden ingezet...; Then we are probably the first people who are working on it. Often we are the first in the organization who have the knowledge that something new is coming up, this is going to have an impact on how we can work. It can be a negative impact. It can be, for example, new security in certain areas. And you think, okay, how can we get there? It can also be that a whole new technology is added. You think, okay, that gives us possibilities. Then we are often the first to signal that these things are there. We say, okay, what are the possibilities? Then we take a chance with it. Then we will first experiment with it. And then we will see if we can make it to the middle, what our people can be used for,
De_Dienst_afl_6_seg_92;0 days 00:25:33;0 days 00:25:52;Liesbeth; ...zodat we inderdaad die inlichting kunnen vragen. En we hebben het nu steeds over technische ontwikkelingen. Ik kan er een voorstelling bij maken... ...maar het is natuurlijk ook een redelijk abstract begrip. Kun je een technische ontwikkeling van een aantal jaar terug noemen... ...die voor jullie veel heeft mogelijk gemaakt? Ik begrijp dat je niet over actuele dingen gaat praten... ...maar kunnen we het op een of andere manier concretiseren?; so that we can ask them about it. And we are still talking about technical developments. I can make a proposal, but it is of course also a fairly abstract concept. Can you name a technical development of a number of years ago that has made a lot of sense for you? I understand that you are not going to talk about current things, but can we concretize it in one way or another?
