seg_id;start;end;speaker;transcription;translation
De_Dienst_afl_6_seg_93;0 days 00:25:52;0 days 00:26:24;Harry; Dat zal ook niet verrassend zijn... ...is natuurlijk dat de komst van mobiele telefonie... ...en de mate waarin mensen daar gebruik van maken... ...onze best mogelijkheden geeft om daar iets actiefs mee te doen. Ik denk ook dat mensen zich daar allerlei dingen kunnen voorstellen... ...zonder dat we op de details hoeven in te gaan. Maar dat geeft natuurlijk aan de ene kant problemen... ...om informatie van mensen naar te krijgen... ...dus de beveiliging daarvan die toeneemt. Aan de andere kant het feit dat mensen telefoons bij zich hebben gebruikt... ...en al dat soort zaken, dat biedt wel mogelijkheden.; One of the things that will not be surprising is of course that the arrival of mobile phone and the extent to which people make use of it gives us quite a few possibilities to do something active with it. I think people can imagine all kinds of things without having to go into the details. But that of course gives problems on the one hand to get information from people, so the protection of those who take it. But on the other hand, the fact that people have used their phones, all kinds of things, that is possible.
De_Dienst_afl_6_seg_94;0 days 00:26:24;0 days 00:26:28;Liesbeth; Bijvoorbeeld de hack op het telefoon van Anas in de zaak van Sander?; For example, the hack on Anas' phone in the case of Sander.
De_Dienst_afl_6_seg_95;0 days 00:26:28;0 days 00:26:55;Harry; Dat is een van de voorbeelden inderdaad. Dat is een operatie die niet per se op locatie plaatsvindt. Dat kan zijn mogelijk voorbereide handelingen... ...waar je wel zegt dat dat op een locatie moet of in de buurt van een target plaatsvindt. Maar een hack is dat typisch een voorbeeld waarvan je zegt... ...dat hoeft niet in de buurt van een target. Dat is juist iets wat je op afstand kan doen. Het werk dat wij hebben heeft veel te maken met zaken... ...die je dicht in de buurt van een target moet vinden.; That is one of the examples indeed. Well, that is typically an operation that does not take place on location. It can be possible preliminary actions, but you do say that it must be at a location or in the vicinity of a target. But a hack is typically an example where you say that does not have to be in the vicinity of a target. That is precisely something you can do remotely. The work we do has a lot to do with things that you have to do close to the target.
De_Dienst_afl_6_seg_96;0 days 00:26:55;0 days 00:26:57;Liesbeth; Wat voor zaken moet ik aan het denken?; What kind of things do I have to think about?
De_Dienst_afl_6_seg_97;0 days 00:26:59;0 days 00:27:19;Harry; Eenvoudige zaken als bijvoorbeeld... ...zorg dat je gespreksinformatie krijgt als iemand in gesprek wordt. Een zaak als misschien een video-observatie... ...dus het in de gaten houden van mensen die met video verhaalden... ...met zeer de middelen. Maar ook in ieder gegevens krijgen we over iemand zijn computer... ...over iemand zijn telefoon al dat soort zaken.; A few things like, for example, make sure that you get information from a conversation when someone is having a conversation. A thing like maybe a video observation, so that you can keep an eye on people who talk to video, with various means. But also, in fact, we get data about someone's computer, about someone's phone, all kinds of things.
De_Dienst_afl_6_seg_98;0 days 00:27:19;0 days 00:27:25;Liesbeth; En gegevens verkrijgen over iemand's telefoon... ...dat betekent niet dat je gaat kijken of het een iPhone is of een Samsung of zo?; And getting data about someone's phone, that doesn't mean that you're going to see if it's an iPhone or a Samsung or something?
De_Dienst_afl_6_seg_99;0 days 00:27:25;0 days 00:27:28;Harry; Nee, dat is wat te weinig gegevens van een telefoon.; No, that's a bit too few data on the phone.
De_Dienst_afl_6_seg_100;0 days 00:27:28;0 days 00:27:30;Liesbeth; We willen het wel graag wat meer hebben.; Yes, exactly. We would like to have a little more.
De_Dienst_afl_6_seg_101;0 days 00:27:30;0 days 00:27:36;Harry; Daar zijn diverse mogelijkheden voor. Dat krijgt misschien net iets te veel wat wij hebben aan doen om daar verder op in te gaan.; Yes, there are various possibilities for that. That might be just a bit too much that we have to do to go further.
De_Dienst_afl_6_seg_102;0 days 00:27:36;0 days 00:27:43;Liesbeth; Modus operandi, dat is de manier waarop jullie werken. Dat lijkt me best spannend. Dat is het ook.; Mode is open-ended. This is the way you work. That seems to me quite exciting. That's it too.
De_Dienst_afl_6_seg_103;0 days 00:27:43;0 days 00:28:06;Harry; Qua spannendheid van werk... ...denk ik persoonlijk dat het niet heel veel spannender wordt dan dit. Werk in Nederland in een operationele omgeving... ...in de buurt van wat wij noemen taarwets... ...dat is wel spannend. Het werk in het buitenl maakt het nog een stuk spannender. Dit is wat vaak nog het zonnest boek waar je mee bezig bent.; In terms of the intensity of work, I personally don't think it will be much more exciting than this. Working in the Netherlands in an operational environment, in the vicinity of what we call Paris, that's already exciting. Working outside makes it a lot more exciting. Yes. Yes, this is what is often called a very boring book that you are working on.
De_Dienst_afl_6_seg_104;0 days 00:28:07;0 days 00:28:38;Liesbeth; Heb je dan ook meerdere paspoorten waar je uit kunt kiezen... ...waarmee je dan die operatie ingaat? Ja. Ik zal niet vragen in welke namen erin staan hoor, geen zorgen. Ja precies, oké. Ik kan me niet voorstellen hoe het moet zijn om met je andere paspoort... ...naar Schiphol te gaan en vliegend in te stappen naar een vervreemd land... ...om dan een geheime operatie uit te voeren. Veel spionneriger kan ik het me bijna niet voorstellen.; Do you also have multiple passports with which you can choose to enter the operation? Yes, I do. Yes. I'm not going to ask you what names are in there. No worries. Yes, exactly. Okay. I can't imagine what it should be like to go to Schiphol with your other passport and get on a plane to a distant country to perform a secret operation. I can hardly imagine it being much more spying.
De_Dienst_afl_6_seg_105;0 days 00:28:39;0 days 00:29:26;Harry; Dat wordt het in zekere zin ook niet. De eerste keer dat je zoiets doet, dan is het ook echt retenspannend. Dan sta je met dat paspoort en dan kijk je nog twaalf keer naar... ...die was er ook alweer, weet ik nog, boordendaten nog. Dat wendt echt na een tijd. In die zin zijn het wel geldige identiteiten. Het is niet zo dat je met een vals paspoort gaat. Je bent het ook daadwerkelijk. Dus in zekere zin is het vrij makkelijk om zo'n identiteit aan te nemen. Je moet een verhaal hebben over wat je achtergrond is. Daar gaat het uiteindelijk om dat je goed binnenkomt met een verhaal... ...over iets wat je niet bent.; That certainly doesn't make sense either. No. And the first time you do something like that, then it's also really exciting. Then you get on with that passport and then you look at it 12 more times. I was there before, I don't know. Birth date and all that stuff. That really happens after a while. After a while, yes. In that sense, they are valid identities. It's not like you're wearing a false passport. You are also valid. So in a sense it's pretty easy to take on such an identity at some point. Say, this is me. You have to have a story about what your background is. That's what it's about, of course, unless you get on with a story about something you're not.
De_Dienst_afl_6_seg_106;0 days 00:29:26;0 days 00:29:30;Liesbeth; En dat moet je wel kunnen. Wordt dat dan ook van tevoren helemaal uitgedacht? Repeteer je dat?; And you have to be able to do that. Is that also challenged from the beginning? Do you repeat that?
De_Dienst_afl_6_seg_107;0 days 00:29:31;0 days 00:29:51;Harry; Ja, dat is een verhaal op het moment dat je echt met dat soort... ...wat wij noemen, aliësten valt werken of pseudo-identiteiten... ...dan is dat van tevoren ook allemaal uitgeschreven. We hebben eerst naar gekeken of met meerdere mensen naar gekeken. Ook met je collega's van oké, klopt dit verhaal. Vaak heeft dat wat te maken met... ...op het moment dat je vertelt dat je iets bent...; Yes, that's a story. That's a story. The moment you really, what we call it, learn how to work, or pseudo identities, then it's all written out from the beginning. What you first looked at, what you looked at with several people. Also with your colleagues. Is this story right? Often it has something to do with, the moment you tell that you are something,
De_Dienst_afl_6_seg_108;0 days 00:29:51;0 days 00:29:53;Liesbeth; ...dan horen er bepaalde vaardigheden bij.; then certain skills are also part of it.
De_Dienst_afl_6_seg_109;0 days 00:29:53;0 days 00:30:15;Harry; Dus ik kan morgen wel vertellen dat ik een lotgieter ben... ...maar als ik nog niet eens weet hoe ik een tang moet vasthouden... ...wordt dat een wat lastig verhaal om in de lucht te houden. Je moet wel gaan zoeken naar een verhaal wat bij jou past... ...waar je kennis over hebt, waar je een achtergrond hebt. Dat kan soms heel complex zijn, maar soms kan het ook heel simpel zijn... ...al naar gelang waar je binnenkomt. Mensen gaan ook op vakantie.; So I can still tell you that I'm a lead guitarist, but if I don't even know how to hold a tongue, then it becomes a bit difficult to keep a story in the air. You have to start looking for a story that suits you, about what you know about, what you have in the background. That can sometimes be a lot of space, but sometimes it can also be very simple. As long as you get in, people also go on vacation.
De_Dienst_afl_6_seg_110;0 days 00:30:16;0 days 00:30:27;Liesbeth; Is het wel eens gebeurd dat je in een operatie een bekende tegen bent gekomen? Die niet weet dat jij dit werk doet? Ja, dat is gebeurd ja. Ja? Ja. Wat gebeurt, kun je daar iets over vertellen?; Has it ever happened that you came across a stranger in an operation? Who doesn't know you're doing this job? Yes, it has happened, yes. Can you tell us something about that?
De_Dienst_afl_6_seg_111;0 days 00:30:29;0 days 00:30:42;Harry; Er komen natuurlijk nog wel zo'n plekken waar mensen ons wat minder verwachten... ...en misschien ook in een uiterlijk of een verschijning... ...die wat mensen in ieder geval niet van je zullen verwachten.; Of course, there are still places where people expect us less. And maybe also in an appearance or appearance, that people will not expect from you.
De_Dienst_afl_6_seg_112;0 days 00:30:43;0 days 00:30:47;Liesbeth; Omdat je er dan alweer als een lotgieter uitziet? Op bewaarschuwing, ja.; Because you suddenly look like a lead guitarist. Oh, that's what I'm talking about, yes.
De_Dienst_afl_6_seg_113;0 days 00:30:48;0 days 00:30:59;Harry; En soms wel... ...in mijn omgeving weten... ...mijn oude vriend weet wel waar ik werk... ...en die weten ook wel dat ze mij niet moeten aanspreken...; And sometimes, in my environment, my old friend knows where I work, and they also know that they can't reach me when they come across me on the street.
De_Dienst_afl_6_seg_114;0 days 00:30:59;0 days 00:31:03;Liesbeth; ...als ze mij op straat tegenkomen. Oh ja, dat hebben jullie met elkaar afgesproken? Ja, dat is heel helder.; Oh yes, you have agreed with each other? Yes, that's very clear.
De_Dienst_afl_6_seg_115;0 days 00:31:04;0 days 00:31:46;Harry; Ze weten ook gewoon dat ik ook in hun buurt een keer aan het werk ben. En dan weten ze ook op het moment dat ik daar ben... ...zeker mijn eentje of met die mensen rondop die ze niet kennen... ...dat ze me gewoon niet moeten aanspreken. Dat zullen ze ook niet doen. Maar natuurlijk is het ook wel om me heen. Er zijn een hele groep mensen die je wel kennen... ...en jou mogelijk zouden aanspreken. De cool is meestal dat je probeert voort te zijn. Dus op het moment dat jij zelf iemand ziet... ...is dat je zelf uit de situatie waar je zit... ...weren uitloopt... ...en jezelf, de persoon gaat er goed... ...en zegt, ik heb even geen tijd voor je... ...waar zullen we binnenkort wat afspreken? En ik bel je om te blijven. En op die manier het contact kort en afhoudt... ...maar zeker niet in een situatie waar... ...zijn ook andere mensen met wie je aan het werk bent... ...of in de omgeving waar je aan het werk bent...; They also know that I can also be working in their neighborhood once. And then they also know that when I'm alone with those people around me, and I know that they just don't have to reach out, that they don't do that either. But of course, if you put them around you, there are a lot of people who you want to know and who you could reach out to. The cool thing is usually that you try to be in front of them. The moment you see someone yourself, is that you walk out of the situation where you are, and you yourself, the person is doing well, and you say, I don't have time for you, where shall we meet in a few days? And in that way, the contact shortens and ends. But certainly not in a situation where there are also other people with whom you are working, or in an environment where you are working,
De_Dienst_afl_6_seg_116;0 days 00:31:46;0 days 00:31:49;Liesbeth; ...daar ik wat mee krijg. Ja, een beetje hiding in plain sight dan dus?; where I can get some experience. Yes, a bit of hiding in plain sight then.
De_Dienst_afl_6_seg_117;0 days 00:31:50;0 days 00:32:03;Harry; Ja, in feite wel. Ik ben een keer tegen een neef van me opgelopen... ...ergens tijdens een klus... ...die ik al een paar jaar niet had gezien. Heel hard daar voorbij gelopen... ...en hij heeft me wel gezien. Dat kan gebeuren, dat soort dingen.; Yes, in fact, I have been to Neva once. Somewhere during a class that I hadn't seen for a few years. I walked by it very hard. And he has seen me. It can happen, those things.
De_Dienst_afl_6_seg_118;0 days 00:32:04;0 days 00:32:14;Liesbeth; Ik zie het nu bijna vormen dat je dus op reis gaat... ...met een kistje vol geheime microfoonjes... ...maar dat zal ook vast niet zo makkelijk zijn. Soms wel. Ja? Ja, soms wel.; I almost see it now that you are going on a trip with a box full of secret microphones, but that won't be that easy either. Sometimes it is. Yes? Yes, sometimes it is.
De_Dienst_afl_6_seg_119;0 days 00:32:14;0 days 00:32:30;Harry; En in een zeker zin, het zijn natuurlijk... ...als wij middelen nodig hebben... ...dan moeten we ze wel meenemen... ...en soms zijn dat echt heimelijke middelen... ...die schreeuwen overheid en moeilijk... ...en kleine microfoonjes inderdaad. Ja, dan moet je goed aanleggen...; And in a sense, of course, if we need resources, then we have to take them with us. And sometimes these are really secret resources, which shout about difficulty and small microphones indeed. Then you have to think about how you are going to take those things with you.
De_Dienst_afl_6_seg_120;0 days 00:32:30;0 days 00:32:34;Liesbeth; ...over hoe je die dingen gaat meenemen. Precies. En daar zijn middelen in wegen voor...; Exactly. And there are resources and ways to transport that.
De_Dienst_afl_6_seg_121;0 days 00:32:34;0 days 00:32:47;Harry; ...om dat te transporteren. En soms betekent dat wel een snetje... ...met een tas vol ellende... ...zelfs wanneer je de grens overgaat. En soms kan dat. En soms kan dat niet. En dan moet je op een andere manier...; And sometimes that means that we walk around with a box full of items, even when we cross the border. And sometimes that is possible. And sometimes that is not possible. And then you have to find other ways to get your resources.
De_Dienst_afl_6_seg_122;0 days 00:32:47;0 days 00:32:52;Liesbeth; ...daar aan je middelen zien komen. En ook daar zijn mogelijkheden voor. Ben je wel eens bang geweest... ...tijdens een operatie?; And there are possibilities for that. Have you ever been scared during an operation?
De_Dienst_afl_6_seg_123;0 days 00:32:52;0 days 00:32:55;Harry; Ja. Ja? Ja.; Yes. Yes? Yes.
De_Dienst_afl_6_seg_124;0 days 00:32:55;0 days 00:32:56;Liesbeth; Waarom?; Why?
De_Dienst_afl_6_seg_125;0 days 00:32:56;0 days 00:33:23;Harry; Er gaan soms wel eens in de operatie dingen... ...niet zoals wij ze in de planning hebben opgeschreven. En dat betekent ook dat je weleens... ...in situatie terug moet komen... ...die potentieel een heel groot gevoel... ...gevoel kunnen hebben voor je persoonlijk... ...maar ook voor de operatie zelf. Maar in name op het moment dat je... ...in een situatie terecht komt waarin... ...toch in het buitenland zit... ...waar mogelijk consequenties aan zitten... ...dat die echt vermist af of erger betekenen.; Sometimes things don't go as we planned. And that also means that you sometimes come across situations that could potentially have a great effect on you personally, but also for the operation itself. Especially when you come into a situation in which you are still abroad, where there are possible consequences that are really harmful or bad for you.
De_Dienst_afl_6_seg_126;0 days 00:33:23;0 days 00:33:30;Liesbeth; Voor jou? Ja. Dan kan het dus vervelend worden. Omdat je dingen doet... ...die door de regering al daar...; For you? Yes, for example, it can be very annoying. Because you do things that are not appreciated by the government there.
De_Dienst_afl_6_seg_127;0 days 00:33:30;0 days 00:33:34;Harry; ...niet gewaardeerd worden. Correct. Heb je dan ook weleens opgepakt?; Correct. Have you ever been caught?
De_Dienst_afl_6_seg_128;0 days 00:33:34;0 days 00:33:39;Liesbeth; Heb je weleens vastgezeten? Niet in een echte situatie, nee. Nee? Nee.; Have you ever been caught? Not in a real situation, no. No? No.
De_Dienst_afl_6_seg_129;0 days 00:33:39;0 days 00:33:55;Harry; Het is wel iets wat we in oefeningen en trainingen... ...en ik ben je verzekerd... ...maar sommige oefeningen en trainingen... ...zijn zo realistisch... ...dat je zelf toch op een of andere manier... ...de enige moeite krijgt... ...om het verschil tussen realiteit... ...en de oefening nog helemaal te hebben... ...en de oefeningen wel degelijk aan.; It's something you want in exercises and training. And I'm sure some exercises and training are so realistic that you still have a slight difficulty to tell the difference between reality and the exercise. And the exercises, yes.
De_Dienst_afl_6_seg_130;0 days 00:33:55;0 days 00:33:59;Liesbeth; En hoe is dat? Ontprettig. Ja? Vooral ook omdat...; And how is that? Disgusting. Yes? Yes, especially because they are often exercises,
De_Dienst_afl_6_seg_131;0 days 00:33:59;0 days 00:34:19;Harry; ...dat vaak toch oefensettings zijn waarin... ...ook een setting gesimuleerd wordt... ...waarin je niet in een Nederlands gevangenis legt. Waar de regels, de manier waarop je met je om wordt gegaan... ...misschien iets anders zijn... ...dan je in Nederland in een gevangenis kan verwachten. Dat gezegd hebben we... ...ik heb het ook in Nederland gehad...; in which a setting is simulated, in which you are not caught in a Dutch prison. Where the rules, the way you are treated, may be something different than you can expect in a prison in the Netherlands. That said, I also had this in the Netherlands.
De_Dienst_afl_6_seg_132;0 days 00:34:19;0 days 00:34:22;Liesbeth; ...dat is ook ontprettig. Hoe ga je daar dan mee om met zo'n angst?; That is also unpleasant. How do you deal with that? With that fear?
De_Dienst_afl_6_seg_133;0 days 00:34:22;0 days 00:34:58;Harry; Op dat moment zo min mogelijk er mee omgaan... ...maar het is iets... ...zeker op het moment dat operaties echt complexer worden... ...en echt zwaarder worden... ...dan is er wel begeleiding van binnenuit. Pijnzaaloperatie, nanoperatie... ...en dat is iets waar we dan over praten. Ook daar komt een stuk ervaring wel bij. Op het moment dat je dit vaker doet... ...worden ook de wat spannende situatie al snel minder spannend. Op het gegeven moment kom je ook in een situatie... ...dat het niet meer gek genoeg kan... ...en daar moet je zo weinig aan remmen... ...om te zeggen, dit was nog wel spannend. Terwijl andere mensen denken... ...het is heel spannend dat je er zelf zit...; At that moment, as little as possible. But yes, it is something, especially at the moment that the operations become more complex and become more difficult, then there is already some guidance from within. Painless operation, nano-operation, and that's what we're talking about. That's also where the experience comes in. When you do this more often, then the exciting situations also become less exciting. At some point you also come into a situation that it can no longer be crazy enough. And then you have to brake yourself a little bit and say, look, this was quite exciting. While other people think, it's really exciting that you're like that.
De_Dienst_afl_6_seg_134;0 days 00:34:58;0 days 00:35:00;Liesbeth; ...en ik vond het echt... ...maar ik mag niet gaan.; I really thought, let's go. Are you an adrenaline junkie?
De_Dienst_afl_6_seg_135;0 days 00:35:00;0 days 00:35:08;Harry; Ben je een adrenaline junkie? Ja. Als ik dit een tijd niet doe... ...dan word ik ook een beetje vervelend.; Yes. If I don't do this for a while, then I get a little annoyed.
De_Dienst_afl_6_seg_136;0 days 00:35:12;0 days 00:35:25;Liesbeth; Net als met je collega... ...is het voor jou groot belang... ...dat jouw identiteit beveiligd blijft? Bebergd blijft? Komt. Hoe ga jij daarmee om? Dat is best lastig.; Just like with your colleague, is it of great importance to you that your identity remains secured, remains limited? Yes. How do you deal with that? That's quite difficult.
De_Dienst_afl_6_seg_137;0 days 00:35:25;0 days 00:35:56;Harry; Zeker op het moment dat ik... ...in mijn privé omgeef... ...omdat ik langer weg ga... ...en soms ook weg ga... ...en dan ook niet kan uitleggen waar ik heen ga. Dus dat zijn wel lastige dingen om te doen. In mijn privésituatie... ...is dat makkelijker. Ik woon samen, ik heb geen kinderen... ...dus het is daar makkelijker om te zeggen... ...ik ben weg... ...en ik kom dan terug tot iets. Ook daar komt een bepaalde gewenning ervaring... ...natuurlijk van beide kanten bij kijken.; Especially at the moment that I, in my private life, I can no longer go away, and sometimes also go away, and then also can't figure out where I'm going. So those are difficult things to do. In my private life, that's easier. I don't have children at home, so it's easier to say, hey, I'm gone, I'll come back, until something, also there comes a certain gain of experience, of course, from both sides.
De_Dienst_afl_6_seg_138;0 days 00:35:58;0 days 00:36:05;Liesbeth; Als we naar onze zaak kijken... ...Sander is geland op Schiphol. Nu is het zo dat de zaak is overgedragen aan de politie...; When we look at our case, Sander has landed in Schiphol. Now the case has been handed over to the police,
De_Dienst_afl_6_seg_139;0 days 00:36:05;0 days 00:36:07;Harry; ...en die hebben we er een volgploeg op gezet.; and we have set up a follow-up team for that.
De_Dienst_afl_6_seg_140;0 days 00:36:07;0 days 00:36:14;Liesbeth; Maar dat zijn dingen die de IFVD ook zelf zou kunnen doen... ...als het onderzoek op een andere manier was gelopen. Zeker.; But these are things that the IFVD could also do if the investigation had been carried out in a different way. Certainly.
De_Dienst_afl_6_seg_141;0 days 00:36:14;0 days 00:36:30;Harry; Er zit een heel scale aan middelen en mogelijkheden... ...die we ter beschikking hebben. En het wat wij noemen onder controle houden van een persoon... ...dat behoort zeker tot de mogelijkheden die we hebben. Enerzijds kan dat zijn inderdaad de middel van de volgnoem... ...en ik kan ook aan technische middelen denken... ...die we inzetten om een persoon...; There is a very large scale of resources and possibilities that we have available. And what we call keeping a person under control, that certainly belongs to the possibilities that we have. On the one hand, it can be in the middle of a follow-up, but I can also think of technical resources that we use to keep a person under control.
De_Dienst_afl_6_seg_142;0 days 00:36:30;0 days 00:36:36;Mixed; ...wat wij noemen onder controle te hebben. Als we de zaak Sander weer als voorbeeld erbij pakken...; If we take Sander's case as an example again,
De_Dienst_afl_6_seg_143;0 days 00:36:36;0 days 00:36:39;Liesbeth; ...gaat Harry dan ongezien in een volgauto achter hem aan?; does Harry then, despite being in a follow-up car,
De_Dienst_afl_6_seg_144;0 days 00:36:40;0 days 00:36:52;Harry; Ik heb al een opleiding om te kunnen volgen... ...dus het is wel iets wat ik er mogelijk bij doe. Maar in principe hebben we daar dedicated mensen voor... ...die eigenlijk ook nog tijdens de beurs zijn... ...om mensen te volgen en te observeren en dat soort zaken.; follow him? I already have a training to be able to follow, so it's something I do as much as possible. But in principle, we have dedicated people for that, who are actually very busy observing the follow-up.
De_Dienst_afl_6_seg_145;0 days 00:36:52;0 days 00:37:00;Liesbeth; Jij gaat liever met z'n telefoon in de weer? Ja, wij zorgen daar meer voor met technische middelen... ...dat we minder gaten kunnen hebben. Dat kan direct met z'n telefoon zijn, dat kan ook.; You prefer to be in the weather with your phone? Yes, we make sure that we have less money with technical resources. That can be directly with your phone,
De_Dienst_afl_6_seg_146;0 days 00:37:00;0 days 00:37:11;Harry; Ik denk dat een GSM-netwerk misschien nog weer iets kunnen... ...al dat soort zaken om te zorgen dat we... ...nogmaals met een scale aan middelen... ...dat we zo dicht mogelijk iemand op z'n huid kunnen blijven zitten.; that can also be. I think from a GSM network, maybe we can do something like that to make sure that we, as with a scale of resources, that we can keep someone under control as close as possible.
